{"capability_version":"1.0.0","config_digest":"376471b9679609464caaee024b4e13f69bbbfdff1dd738931e06fc582caf53af","dsl_version":"codestrata.io/rules/v1","effective_ruleset_digest":"6851c8c1ceab3c8930ef57da567b2a051fdb57d74d7fef88b8f192fa8e7a8e24","execution_purpose":"production","feed_digest":null,"input_digest":"f1fa9293f0effb4f419bee1491fef03b4e4f386ca0a37d1089ab64b46b26cfe0","local_unsigned_config_digest":"2c4c78bafc94eca1ce8638c1a143914aaa18d7888726b82b5c4b49c0a8c09cf9","ordered_composition":[],"package_digest":"f1fa9293f0effb4f419bee1491fef03b4e4f386ca0a37d1089ab64b46b26cfe0","preview_cannot_authorize_production":true,"resolver_version":"1.0.0","rules":[{"adoption":"recommended","default_enabled":true,"default_severity":"high","effective_severity":"medium","enabled":true,"exception_refs":[],"override_source":"policy:opaque:customer.pack@1.0.0","parameters":{},"policy_refs":["policy:opaque:customer.pack@1.0.0"],"revision":"1.0.0","rule_digest":"b97b6d9fd8a443164020dc972219c3dc5a109cba22e50e71f56803e24a7a696c","rule_id":"architecture.dependency-cycle","selector_digest":"6c592538df233e39ddb5d9fff2a3bf191eeabe58600fcd7b5475cfdb7c546048"}],"ruleset_id":"codestrata.engineering-standard","ruleset_version":"1.0.0","schema_name":"codestrata.effective-ruleset.v1","schema_version":"1.0.0","signed_base_digest":"f556519b930f4fce46c2cefd7fab66d965175f31d955a7b498830d7e080eed7a","validity_not_after":"2027-09-15T00:00:00Z","validity_not_before":null}
