{"capability_version":"1.0.0","config_digest":"853d281a07ff0e8746c6c1322d82aa44d7dda2ab5038e1ae204a41170c364f8f","dsl_version":"codestrata.io/rules/v1","effective_ruleset_digest":"fb33d17b8db0d5c99171f4bba3f9150ac6d8fc13c04bb14ed055a0722ca4cca3","execution_purpose":"production","feed_digest":"74f09825bbc6e8f80a7ac017893662aec625563d5da9dafab89ab6ef13e60f27","input_digest":"08a0a677751a2d019f22578c1d9c50fa91b0e55cf51ec5c6e201d408cf7549b1","local_unsigned_config_digest":"c81aa490fd0be9957898f7726136b8ad6d933be6c4300204581bcc780a179314","ordered_composition":[{"digest":"16c0c268a6f236ef79ef86fb8b0676c47081cba963c0b3f2847e1aef804eb962","id":"codestrata.engineering-health","version":"1.0.0"}],"package_digest":"fc3acd86106573661262441c70b9322cd8c1de88dbb2916ec7b03ceaff9caa37","preview_cannot_authorize_production":true,"resolver_version":"1.0.0","rules":[{"adoption":"recommended","default_enabled":true,"default_severity":"high","effective_severity":"high","enabled":true,"exception_refs":[],"override_source":null,"parameters":{},"policy_refs":["policy:opaque:acme.engineering-policy@3"],"revision":"1.0.0","rule_digest":"b97b6d9fd8a443164020dc972219c3dc5a109cba22e50e71f56803e24a7a696c","rule_id":"architecture.dependency-cycle","selector_digest":"3c4852d25475b127e4dd586e7c184b4e94ad3f29a6fac10dd22ac7d813654943"}],"ruleset_id":"codestrata.engineering-standard","ruleset_version":"1.0.0","schema_name":"codestrata.effective-ruleset.v1","schema_version":"1.0.0","signed_base_digest":"1a780d941937a77ebd599f14aa04ccef478ca16efb17a067f93417e9cc519e13","validity_not_after":"2027-09-15T00:00:00Z","validity_not_before":null}
