{"capability_version":"1.0.0","config_digest":"5a17660a325f5c3e25dfebe260876d8e81f9c7ea2367d5f2cd675f2e70773c98","dsl_version":"codestrata.io/rules/v1","effective_ruleset_digest":"d153624dc76b035f3acfea8adcb0596a4f07293ff5c49c17b3a924ad62dade59","execution_purpose":"production","feed_digest":null,"input_digest":"e3896c7b8235e0678904951b658a460fc019b036c8c45f31e06f0b7b295b4130","local_unsigned_config_digest":"2c4c78bafc94eca1ce8638c1a143914aaa18d7888726b82b5c4b49c0a8c09cf9","ordered_composition":[{"digest":"e36232ee3bea599c7af6186d59224a5528b630dd48ee588bb5f721523d91b2ad","id":"codestrata.engineering-health","version":"1.0.0"}],"package_digest":"e3896c7b8235e0678904951b658a460fc019b036c8c45f31e06f0b7b295b4130","preview_cannot_authorize_production":true,"resolver_version":"1.0.0","rules":[{"adoption":"recommended","default_enabled":true,"default_severity":"high","effective_severity":"high","enabled":true,"exception_refs":[],"override_source":null,"parameters":{"max_cycle_length":4},"policy_refs":[],"revision":"1.0.0","rule_digest":"b97b6d9fd8a443164020dc972219c3dc5a109cba22e50e71f56803e24a7a696c","rule_id":"architecture.dependency-cycle","selector_digest":"6c592538df233e39ddb5d9fff2a3bf191eeabe58600fcd7b5475cfdb7c546048"}],"ruleset_id":"codestrata.engineering-standard","ruleset_version":"1.0.0","schema_name":"codestrata.effective-ruleset.v1","schema_version":"1.0.0","signed_base_digest":"722c69ebc69ca5f9dee4c86d33bf221880af5975fc8b70430ffefd4b8dd7814f","validity_not_after":"2027-09-15T00:00:00Z","validity_not_before":null}
